<project-execution-model
	xmlns="https://api.runeduniverse.net/runes4tools/r4m-pem"
	xmlns:xsi="http://www.w3.org/2001/XMLSchema-instance"
	xsi:schemaLocation="https://api.runeduniverse.net/runes4tools/r4m-pem 
	https://api.runeduniverse.net/runes4tools/r4m-pem-v1_0_0.xsd">

	<modelVersion>1.0.0</modelVersion>
	<executions>

		<execution source="plugin" id="default">
			<triggers>
				<default />
			</triggers>
			<lifecycles>
				<lifecycle id="help">
					<phases>
						<phase id="help">
							<goals>
								<goal id="help">
									<groupId>net.runeduniverse.tools.maven.r4m</groupId>
									<artifactId>r4m-maven-extension</artifactId>
									<modes>
										<default />
										<dev />
									</modes>
								</goal>
							</goals>
						</phase>
					</phases>
				</lifecycle>
			</lifecycles>
		</execution>

	</executions>
</project-execution-model>
