<!-- <project-execution-model xmlns="https://api.runeduniverse.net/runes4tools/r4m-pem" 
	xmlns:xsi="http://www.w3.org/2001/XMLSchema-instance" xsi:schemaLocation="https://api.runeduniverse.net/runes4tools/r4m-pem 
	https://api.runeduniverse.net/runes4tools/r4m-pem-v1_0_0.xsd"> -->
<project-execution-model
	xmlns="https://api.runeduniverse.net/runes4tools/r4m-pem"
	xmlns:xsi="http://www.w3.org/2001/XMLSchema-instance"
	xsi:schemaLocation="https://api.runeduniverse.net/runes4tools/r4m-pem r4m-pem-v1_1_0.xsd">

	<modelVersion>1.1.0</modelVersion>
	<executions>

		<execution id="default" source="override">
			<triggers>
				<always />
			</triggers>
			<lifecycles>
				<lifecycle id="default">
					<phases>
						<phase id="compile">
							<goals>
								<goal id="compiler-summary">
									<modes>
										<mode id="default"/>
										<mode id="dev"/>
									</modes>
									<groupId>net.runeduniverse.tools.maven.r4m</groupId>
									<artifactId>r4m-maven-extension</artifactId>
									<fork>
										<mode id="default"/>
										<executions>
											<execution id="default" />
										</executions>
										<lifecycle id="compiler" />
									</fork>
								</goal>
							</goals>
						</phase>
						<phase id="test-compile">
							<goals>
								<goal id="compiler-summary" optional="true">
									<modes>
										<mode id="default"/>
										<mode id="dev"/>
									</modes>
									<groupId>net.runeduniverse.tools.maven.r4m</groupId>
									<artifactId>r4m-maven-extension</artifactId>
									<fork>
										<mode id="default"/>										
										<executions>
											<execution id="test" />
										</executions>
										<lifecycle id="compiler" />
									</fork>
								</goal>
							</goals>
						</phase>
					</phases>
				</lifecycle>
			</lifecycles>
		</execution>

	</executions>
</project-execution-model>